platform,canonical_sku,review_id,review_date,rating,review_text
Amazon,B0GEN2200,B0GEN2200-R1,2025-11-30,4.7,quiet startup and reliable power output
Amazon,B0GEN2200,B0GEN2200-R2,2025-11-30,4.7,easy setup and solid value
Amazon,B0GEN3000,B0GEN3000-R1,2025-11-30,4.8,premium feel and smooth start
Amazon,B0GEN3000,B0GEN3000-R2,2025-11-30,4.8,excellent power and very quiet
Amazon,B0GEN2100,B0GEN2100-R1,2025-11-30,4.6,reliable portable unit
Amazon,B0GEN2100,B0GEN2100-R2,2025-11-30,4.6,great value and compact size
