platform,canonical_sku,review_id,review_date,rating,review_text
TikTok Shop,TT-GEN1800,TT-GEN1800-R1,2025-11-30,4.1,portable budget option
TikTok Shop,TT-GEN1800,TT-GEN1800-R2,2025-11-30,4.1,manual start is hard
TikTok Shop,TT-GEN1700,TT-GEN1700-R1,2025-11-30,3.8,cheap handle and weak power
TikTok Shop,TT-GEN1700,TT-GEN1700-R2,2025-11-30,3.8,damaged packaging on arrival
TikTok Shop,TT-GEN2400,TT-GEN2400-R1,2025-11-30,4.5,easy setup and strong value
TikTok Shop,TT-GEN2400,TT-GEN2400-R2,2025-11-30,4.5,quiet operation for camping
